101,Skin Care,"Paul Penders Botanical Lavender Body Lotion, 250 g ","About the Product|This rich formula contains organic herbs and refreshing lavender essential oil to nurture and revive dry skin while eliminating flakiness. Emollients derived from selected cold-pressed plant oils to provide optimal bioavailability. Leaves skin smooth, soft and fragrant. An uplifting and calming all over body lotion with our levensessentie gold. It prevents dryness and heals sunburn..This rich formula contains organic herbs and refreshing lavender essential oil to nurture and revive dry skin while eliminating flakiness. Emollients derived from selected cold-pressed plant oils to provide optimal bioavailability. Leaves skin smooth, soft and fragrant. An uplifting and calming all over body lotion with our levensessentie gold. It prevents dryness and heals sunburn..This rich formula contains organic herbs and refreshing lavender essential oil to nurture and revive dry skin while eliminating flakiness. Emollients derived from selected cold-pressed plant oils to provide optimal bioavailability. Leaves skin smooth, soft and fragrant. An uplifting and calming all over body lotion with our levensessentie gold. It prevents dryness and heals sunburn.|Features|• Nurture and revive dry skin while eliminating flakiness• Provide optimal bio-availability• Leaves skin smooth, soft and fragrant.• Nurture and revive dry skin while eliminating flakiness• Provide optimal bio-availability• Leaves skin smooth, soft and fragrant.• Nurture and revive dry skin while eliminating flakiness.• Provide optimal bio-availability.• Leaves skin smooth, soft and fragrant|Composition|Aqua, Cocos Nucifera (Coconut) Extract, Prunus Dulcis (sweet Almond) Oil, Glycerin, Cetearyl Olivate, Sorbitan Olivate, Sesamum Indicum (Sesame) Seed Oil, Carthamus Tinctorius (safflower) Oil, Theobroma Cacao (cocoa) Seed Butter, Tocopherol Acetate (VItamin E), Lavendula Officinalis (Lavender) Oil, Cocos Nucifera (Coconut) Oil, Angelica ArchAngelica (Angelica) Powder, Arnica Montana (Arnica) Flower Powder, Calendula Officinalis (Calendula) Flower Powder, Matricaria Recutita (Chamomile) Flower Powder, Sambucus Nigra (Elderflower) Flower Powder, Zingiber Officinalis (Ginger) Root Powder, Panax Quinquefolium (Ginseng) Root Powder, Lonicera Japonica (Honeysuckle) Powder, Humulus Lupulus (Hops) Powder, Equisetum Hyemale (Horsetail) Powder, Juniperus Communis (Juniper) Fruit Powder, LavAndula Angustifolia (Lavender) Flower Powder, Melissa Officinalis (Lemon Balm) Leaf Powder, Urtica Dioica (Nettle) Powder, Centella Asiatica (Pennywort) Powder, Mentha Piperita (Peppermint) Leaf Powder, Rosemarinus Officinalis (Rosemary) Powder, Salvia Officinalis (Sage) Powder, Hypericum Perforatum (st. Johns Wort) Powder, Curcuma Longa (Turmeric) Root Powder, Hamamelis Virginiana (witch Hazel) Powder, Archillea Millefolium (Yarrow) Powder, Phyto-tocotrienol (VItamin E), Rosemarinus Officinalis (Rosemary) Oil, Orbigya Oleifera (babassu) Oil, Calendula Officinalis (Calendula) Flower Oil, Ananas Comosus (bromelain) Extract, Carica Papaya (papain) Extract, Pelargium Graveolens (geranium) Oil, Ubiquinone (coenzyme Q10), Caprylhydroxamatic Acid (Amino Acid) (And) Glyceryl Caprylate. mnt. Everest Water. antioxidants (Coconut Derived Acting As Natural Preservative). citronellol, Limonene, Coumarin, Geraniol, Linalool ( Occurs Naturally In Essential Oils). Levensessentie Gold From 22 Organic Herbs.Aqua, Cocos Nucifera (Coconut) Extract, Prunus Dulcis (sweet Almond) Oil, Glycerin, Cetearyl Olivate, Sorbitan Olivate, Sesamum Indicum (Sesame) Seed Oil, Carthamus Tinctorius (safflower) Oil, Theobroma Cacao (cocoa) Seed Butter, Tocopherol Acetate (VItamin E), Lavendula Officinalis (Lavender) Oil, Cocos Nucifera (Coconut) Oil, Angelica ArchAngelica (Angelica) Powder, Arnica Montana (Arnica) Flower Powder, Calendula Officinalis (Calendula) Flower Powder, Matricaria Recutita (Chamomile) Flower Powder, Sambucus Nigra (Elderflower) Flower Powder, Zingiber Officinalis (Ginger) Root Powder, Panax Quinquefolium (Ginseng) Root Powder, Lonicera Japonica (Honeysuckle) Powder, Humulus Lupulus (Hops) Powder, Equisetum Hyemale (Horsetail) Powder, Juniperus Communis (Juniper) Fruit Powder, LavAndula Angustifolia (Lavender) Flower Powder, Melissa Officinalis (Lemon Balm) Leaf Powder, Urtica Dioica (Nettle) Powder, Centella Asiatica (Pennywort) Powder, Mentha Piperita (Peppermint) Leaf Powder, Rosemarinus Officinalis (Rosemary) Powder, Salvia Officinalis (Sage) Powder, Hypericum Perforatum (st. Johns Wort) Powder, Curcuma Longa (Turmeric) Root Powder, Hamamelis Virginiana (witch Hazel) Powder, Archillea Millefolium (Yarrow) Powder, Phyto-tocotrienol (VItamin E), Rosemarinus Officinalis (Rosemary) Oil, Orbigya Oleifera (babassu) Oil, Calendula Officinalis (Calendula) Flower Oil, Ananas Comosus (bromelain) Extract, Carica Papaya (papain) Extract, Pelargium Graveolens (geranium) Oil, Ubiquinone (coenzyme Q10), Caprylhydroxamatic Acid (Amino Acid) (And) Glyceryl Caprylate. mnt. Everest Water. antioxidants (Coconut Derived Acting As Natural Preservative). citronellol, Limonene, Coumarin, Geraniol, Linalool ( Occurs Naturally In Essential Oils). Levensessentie Gold From 22 Organic Herbs.Aqua, Cocos Nucifera (Coconut) Extract, Prunus Dulcis (sweet Almond) Oil, Glycerin, Cetearyl Olivate, Sorbitan Olivate, Sesamum Indicum (Sesame) Seed Oil, Carthamus Tinctorius (safflower) Oil, Theobroma Cacao (cocoa) Seed Butter, Tocopherol Acetate (VItamin E), Lavendula Officinalis (Lavender) Oil, Cocos Nucifera (Coconut) Oil, Angelica ArchAngelica (Angelica) Powder, Arnica Montana (Arnica) Flower Powder, Calendula Officinalis (Calendula) Flower Powder, Matricaria Recutita (Chamomile) Flower Powder, Sambucus Nigra (Elderflower) Flower Powder, Zingiber Officinalis (Ginger) Root Powder, Panax Quinquefolium (Ginseng) Root Powder, Lonicera Japonica (Honeysuckle) Powder, Humulus Lupulus (Hops) Powder, Equisetum Hyemale (Horsetail) Powder, Juniperus Communis (Juniper) Fruit Powder, LavAndula Angustifolia (Lavender) Flower Powder, Melissa Officinalis (Lemon Balm) Leaf Powder, Urtica Dioica (Nettle) Powder, Centella Asiatica (Pennywort) Powder, Mentha Piperita (Peppermint) Leaf Powder, Rosemarinus Officinalis (Rosemary) Powder, Salvia Officinalis (Sage) Powder, Hypericum Perforatum (st. Johns Wort) Powder, Curcuma Longa (Turmeric) Root Powder, Hamamelis Virginiana (witch Hazel) Powder, Archillea Millefolium (Yarrow) Powder, Phyto-tocotrienol (VItamin E), Rosemarinus Officinalis (Rosemary) Oil, Orbigya Oleifera (babassu) Oil, Calendula Officinalis (Calendula) Flower Oil, Ananas Comosus (bromelain) Extract, Carica Papaya (papain) Extract, Pelargium Graveolens (geranium) Oil, Ubiquinone (coenzyme Q10), Caprylhydroxamatic Acid (Amino Acid) (And) Glyceryl Caprylate. mnt. Everest Water. antioxidants (Coconut Derived Acting As Natural Preservative). citronellol, Limonene, Coumarin, Geraniol, Linalool ( Occurs Naturally In Essential Oils). Levensessentie Gold From 22 Organic Herbs|How to Use|After showering, apply to entire body.After showering, apply to entire body.After showering, apply to entire body|Other Product Info|EAN Code: 40141728  Manufacturer name & address: Paul Penders Botanicals India Pvt. Ltd. B-4, Sara Industrial Estate, Selaqui, Dehradun - 248197 - Uttarakhand  Best before 19-01-2021  For Queries/Feedback/Complaints, Contact our Customer Care Executive at: Phone: 1860 123 1000 | Address: Innovative Retail Concepts Private Limited, No.18, 2nd & 3rd Floor, 80 Feet Main Road, Koramangala 4th Block, Bangalore - 560034 | Email: customerservice@bigbasket.com",Paul Penders Botanical,250 g ,2195,2195,NA,FALSE,https://www.bigbasket.com/media/uploads/p/l/40141728_1-paul-penders-botanical-lavender-body-lotion.jpg
102,Skin Care,"Palmer's Nursing Butter, 30 g Tube ","About the Product|Palmers Cocoa Butter Formula Nursing Butter is an easy-to-apply combination of pure Cocoa Butter and (Panthenol) Pro-Vitamin B5. Also may be used prenatally to condition nipples for breastfeeding..Palmers Cocoa Butter Formula Nursing Butter is an easy-to-apply combination of pure Cocoa Butter and (Panthenol) Pro-Vitamin B5. Also may be used prenatally to condition nipples for breastfeeding..Palmers Cocoa Butter Formula Nursing Butter is an easy-to-apply combination of pure Cocoa Butter and (Panthenol) Pro-Vitamin B5. Also may be used prenatally to condition nipples for breastfeeding.|How to Use|Apply a small amount of Palmers Cocoa Butter Formula Nursing Cream to nipple area after each feeding or as often as needed.Apply a small amount of Palmers Cocoa Butter Formula Nursing Cream to nipple area after each feeding or as often as needed.Apply a small amount of Palmers Cocoa Butter Formula Nursing Cream to nipple area after each feeding or as often as needed|Composition|Cocoa Butter, Pro Vitamin B5.Cocoa Butter, Pro Vitamin B5.Cocoa Butter, Pro Vitamin B5|Features|• Helps relieve sore, cracked nipples associated with breastfeeding• Soothing emollient base• Dermatologically Tested.• Helps relieve sore, cracked nipples associated with breastfeeding• Soothing emollient base• Dermatologically Tested.• Helps relieve sore, cracked nipples associated with breastfeeding.• Soothing emollient base.• Dermatologically Tested|Other Product Info|EAN Code: 10181040375  Manufactured & Marketed by: PALMER'S E.T. BROWNE DRUG CO. INC, ENGLEWOOD CLIFFS, NJ 07632, USA  Country of origin:USA  Best Before__PSL__days from the date of delivery  For Queries/Feedback/Complaints, Contact our Customer Care Executive at: Phone: 1860 123 1000 | Address: Innovative Retail Concepts Private Limited, No.18, 2nd & 3rd Floor, 80 Feet Main Road, Koramangala 4th Block, Bangalore - 560034 | Email: customerservice@bigbasket.com",Palmer's,30 g ,390,312,20%,TRUE,https://www.bigbasket.com/media/uploads/p/l/20004791_3-palmers-nursing-butter.jpg
103,Skin Care,"Kama Ayurveda Hand Cream, 60 g ","About the Product|An enriching Hand Cream made with Cold Pressed Sweet Almond and Coconut Oils that nourishes and rejuvenates hand and cuticles. Infused with Shea, Cocoa and Kokum Butters, it helps regenerate skin cells and absorbs deeply for touchably soft and smooth hands. Aloe Vera juice is added as an antiseptic agent to protect the skin. Pure essential oils of Tuberose, Vetiver and Cardamom keep hands scented all day with a sweet and spicy fragrance..An enriching Hand Cream made with Cold Pressed Sweet Almond and Coconut Oils that nourishes and rejuvenates hand and cuticles. Infused with Shea, Cocoa and Kokum Butters, it helps regenerate skin cells and absorbs deeply for touchably soft and smooth hands. Aloe Vera juice is added as an antiseptic agent to protect the skin. Pure essential oils of Tuberose, Vetiver and Cardamom keep hands scented all day with a sweet and spicy fragrance.|Composition|Aloe Vera, Cocoa, Kokum Butter, Tuberise, Vetiver, Almond..Aloe Vera, Cocoa, Kokum Butter, Tuberise, Vetiver, Almond.|How to Use|Take a small amount on your palms and gently massage on your hands, covering fingers and cuticles.Due to the rich formula, it is recommended to use small dabs of the product at one time.|Other Product Info|EAN Code: 40168053  Manufacturer Name and Address: 91, Palamedu Road, Alanganallur, Madurai-625501  Country of origin: India  Best before 23-07-2020  For Queries/Feedback/Complaints, Contact our Customer Care Executive at: Phone: 1860 123 1000 | Address: INNOVATIVE RETAIL CONCEPTS PRIVATE LIMITED No.18, 2nd & 3rd Floor, 80 Feet Main Road, Koramangala 4th Block, Bangalore - 560034. | Email: customerservice@bigbasket.com",Kama Ayurveda,60 g ,725,725,NA,TRUE,https://www.bigbasket.com/media/uploads/p/l/40168059_3-kama-ayurveda-hand-cream.jpg
104,Skin Care, Ubervia Pack of 1 Natural Organic VioletFlowder ,"Item Type: Bath, Quantity: 1 bag, NET WT: 50g 200g 500g, Ingredient: Natural Flower, Model Number: Violet, Unit Type: Pack",Ubervia,NA,9086,5192,42.86%,TRUE,https://images-na.ssl-images-amazon.com/images/I/41-%2BZf2RVcL.jpg
105,Skin Care, 100pcs DIY Women Makeup Beauty Tool Compressed Face Mask Paper Disposable Facial Masks Papers Natural Skin Care Wrapped Masks ,Material:Natural Cellulose FiberPackage includes:1 pc,BZA Mart,NA,2466,1897,23.07%,TRUE,https://images-na.ssl-images-amazon.com/images/I/513E4N8O9aL.jpg
106,Skin Care, Ubervia Pack of 1 Beauty Mini Eye Massage Device Pen Type Electric Eye Massager Facials Vibration Face Magic Stick Anti Bag Pouch & Wrinkle ,"Material: Plastic, False Eyelash Craft: Machine Made, Size: as picture show Type: eye massage care",Ubervia,NA,1100,1100,NA,TRUE,https://images-na.ssl-images-amazon.com/images/I/51PInL4%2BJnL._SL1100_.jpg
107,Skin Care, FairOnly 5Pcs/Pack Soap Pape Sheets Travel Portable Washing Hand Soap Gifts Package Paper Soap Random Color ,,FairOnly,NA,1594.52,797.26,50.00%,TRUE,https://images-na.ssl-images-amazon.com/images/I/61g4TZnyB1L._SL1189_.jpg
108,Skin Care, Sattva Medium Spa Gift Set ,"Indulge in our spa set which contains two different kinds of loofah - For body sponging and back scrubbing, small sized bath towel, wooden wheels for accupressure and wodden comb.",Sattva Life,381 g,1000,999,NA,TRUE,https://images-na.ssl-images-amazon.com/images/I/71Rcdwc7l9L._SL1199_.jpg
109,Skin Care, Genuine 2017 Deluxe Manicure Set With Deluxe Carrying Case For Journey And Finelife Drop Whole ,Item type set kit quantity the deluxe 10 piece manicure set brand name yks size case dimensions 1 x 5875 x 3375 inches model number manicure tools material stainless steel unit type piece package weight package size,Genuine,NA,816,483,40.81%,TRUE,https://images-na.ssl-images-amazon.com/images/I/51jU8J5IacL.jpg
110,Skin Care, SWD Prime Blackhead Removal Black Mask Peel-Off Smoothes Skin Tender Purifying Deep Cleansing 60Ml ,"Features: 1. Oil-control, pore cleaner, keep your face smoother and tender. 2. Cleaning out of dirt and cuticle effectively on face. 3. Helps to remove stain or oil spots on your face with daily use. Description: Item Type: Blackhead Removal Mask Color: Black Capacity: 60ml Gross Weight: App 80g Size: App 12.5X3.5X5cm Ingredient: Water, Vitamin A, Vitamin E, Denatured Ethanol, Polyvinyl Alcohol, Hamamelis Virginiana, etc. Package Included: 1 X Blackhead Removal Mask",SWD Prime,NA,6669,4874,26.92%,TRUE,https://images-na.ssl-images-amazon.com/images/I/41Mwp74KKxL.jpg
111,Skin Care, Lavera Organic Mint Pore Refining Moisturising Fluid 50ml/1. 6oz ,,lavera,45.4 g,6659,6659,NA,TRUE,https://images-na.ssl-images-amazon.com/images/I/31NwpEYYhML.jpg
112,Skin Care, Face Skin Care Starry Sky Glow Glitter Sequin Mask Peel off Moisturizing Mask (type 3) ,Type:Face careSize:Approx.6 x 6 x 5cmMaterial:As Features ShownPachage includes:1 pc,BZA Mart,NA,1642,1263,23.08%,TRUE,https://images-na.ssl-images-amazon.com/images/I/51xe9agFAML.jpg
113,Skin Care, Yashus Rorec Snail Extract Face Cream Skin Care Concealling Whitening Moisturizing Day Cream ,"Nourish the skin, add the required water to the skin, oil water balancing Moisturizing, hydrating the skin and make the skin smooth, Helps to improve skin dryness. Item Type: HANCHAN Snail Extract Face Cream NET WT: 50g Quantity: 1pcs",YASHUS,49.9 g,4357,4207,3.44%,TRUE,https://images-na.ssl-images-amazon.com/images/I/61FI3cepxkL._SL1288_.jpg
114,Skin Care," Wild Stone Night Rider Deodorant (150 ml), Code Gold Body Perfume(120 ml) and Secret Temptation Play Deodorant (150 ml), Te Amo Aqua Body Perfume (120 ml), Pack of 4 ",A combination of best of both the worlds. Fresh fragrance which gives you a unique identity. With freshness which lasts up to 12 hours!,Secret Temptation and Wild Stone,449 g,838,629,24.94%,TRUE,https://images-na.ssl-images-amazon.com/images/I/61JR8xDBDxL._SL1100_.jpg
115,Skin Care," Kings & Queens Shower Gel, Nefertiti - Honey 10.14 fl oz (300 ml) ",Scent Name:Nefertiti - Honey,Kings and Queens,NA,8164,6531,20.00%,TRUE,https://images-na.ssl-images-amazon.com/images/I/41m6rmjjroL.jpg
116,Skin Care," The Body Shop Shower Scrub and Soften Luxury Gift, Olive ",NA,The Body Shop,NA,7599,7599,NA,TRUE,https://images-na.ssl-images-amazon.com/images/I/81PmI7znrML._SL1500_.jpg
117,Skin Care, Ancient flower - Rose Water - Premium Quality & Katha - Tea Tree and Lemon Oil in serum (Night) (100ml + 10ml) ,"FACE SERUM:- Katha- Tea Tree and Lemon Oil in serum. AND ROSE WATER: This product is made from rose flowers. Rose Water works well with acne prone skin, hand spots, dark marks, and combination-oily skin. Balance your skin naturally with a botanical astringent of natural Rose Water. Rose Water should naturally even the pH of your skin and soothe recurring redness. PORE CLEANSING. Rose water helps clean pores and tone the skin.Rosewater helps to control excess oil and keep your skin feeling super fresh that aids in removing oil and dirt accumulated in clogged pores. MOISTURIZING. It helps hydrate, revitalize and moisturize the skin and maintain the skin's pH balance. TONE: Rosewater can tone down and alleviate temporary redness. SMOOTH YOU :Rosewater helps to enhance smoothness and minimize the appearance of fine lines GREAT ANTIOXIDANT. It helps to strengthen skin cells and regenerate skin tissues, reducing wrinkles and fine lines. SETTING SPRAY. It helps set your makeup. It hydrates your skin and keeps your makeup looking fresh SAFE & EFFECTIVE. No harmful chemicals that may harm your skin. ADDS SHINE TO DULL HAIR - Natural Rose Water contains gentle and natural antioxidants that remove pollutants from hair and boost hair health. Spray or apply after using shampoo or conditioner to gently tone and brighten hair. Relax to the scent of rose petals and notice how radiant your hair looks! Also can be used as a refreshing body spray, a natural refreshing mist for face and body during summer, as an ingredient in natural beauty products, or as a relaxing mist to counteract stress. Rosewater feels AMAZING! As a natural face mist it’s incredibly refreshing. Use: After Cleansing Pat dry and use rose water, morning and evening",Ancient Flower,27.2 g,749,299,60.08%,TRUE,https://images-na.ssl-images-amazon.com/images/I/71ii1y28CTL._SL1500_.jpg
118,Skin Care, KOSE COSMEPORT softymo Super Cleansing Wash Collagen 190g ,KOSE Softy Mo Collagen Makeup Cleansing and Facial Foam,Kose,227 g,2739,2739,NA,TRUE,https://images-na.ssl-images-amazon.com/images/I/61O7WRO7ypL._SL1500_.jpg
119,Skin Care, PINK PLUMS Diamond Facial Gel | Apricot Scrub | Neem-Tulsi Face Pack | Papaya Massage Cream with Vitamin E COMBO (Pack of 4) Each 250 ml ,"Using the products from the Pink Plums Gel & Cream will leave your skin polished, cleansed, and feeling fresh. It contains Vitamin E, It also builds the skin’s immunity against damage and pollution.Vitamin E, helps to nourish and moisturise your skin, leaving it soft and glowing. This helps restore youthful skin, removes wrinkles, and fine lines eventually. Its help in regenerating skin cells by going deeper into the skin layers, cleaning the pores and enhancing your skin’s texture. Facial Gel Gently removes impurities and leaves the skin feeling smooth, refreshed and comfortable. Gel is suitable for combination, dry, normal & oily skin. It is also helpful for acne prone skin and can be used by teens and adults. Scrub, it Exfoliates Dead Skin Cells And Gives A Natural Glow to your skin & Makes Your Skin Soft & Happy. This Is a product that is capable of making your skin much better than before. It is not necessary to use the products every day. For best results, apply on the face circular movements for a few minutes. It is good to apply twice a Week. This face Pack needs to be applied on the entire surface of your face, except the area around eyes, and should be left for 30 minutes to dry. After bring washed off with normal water, this PINK PLUMS Face Pack leaves your skin soft and smooth immediately after use.  Apply PINK PLUMS MASSAGE CREAM on your face & body gently for 10-15 minutes into the area until it is absorbed for softer, smoother and younger looking skin. Wipe off excess cream using a moist cotton/ wet tissue. As you gently massage your face work in small concentric circles all over your face & body. Pay special attention to massage upwards and not pull down on any delicate skin.",Pink Plums,NA,999,349,65.07%,TRUE,https://images-na.ssl-images-amazon.com/images/I/81qA95s48dL._SL1500_.jpg
120,Skin Care, Ubervia Pack of 1 WomenNap Sleeping Eye Mask Travel Vocation Sleeping Cover Shade Portable Eye Patch Blinder Sponge ,"Type: health and beauty, Size: 20*8 cm/20*11 cm/18*8 cm/19*8 cm/19*8 cm, False Eyelash Craft: Machine Made, Model Number: blindfold, Material: coral fleece, cloth",Ubervia,NA,1925,1100,42.86%,TRUE,https://images-na.ssl-images-amazon.com/images/I/51lQuZyel8L._SL1000_.jpg
121,Skin Care," Joy and Karma J&K Best Hyaluronic Acid Serum for Face with Vitamin C, E & MSM ~ Professional Hydrating Moisturizer for Skin ~ Non-greasy & Paraben Free ~ 1 fl oz ","Important: ite to our attention that a small percentage of our bottle dropper caps (~2% to 5%) may not function properly and could potentially result in the bottle leaking. But no worries! if you are affected by this, please get in touch with us by email (as printed on the box and bottle) and we will send you not one but two replacement bottles. We hope this will make up for any inconveniences caused. Finally, we want to thank all our loyal customers for sticking with us through these tough times while we transition to this new packaging design. ~joy and karma",Joy+and+Karma,NA,8614,8614,0%,TRUE,https://images-na.ssl-images-amazon.com/images/I/61gHO3TfibL._SL1200_.jpg
122,Skin Care, The EnQ Magical Moringa Facial Cleanser Natural Cleansing Milk With Moringa Extract Deep Cleaning Hydrating Cleanser for Women and Men Cleanser for Make Up Removal 200 ml without Emulsifying Wax ,NA,The EnQ,NA,490,449,8.37%,TRUE,https://images-na.ssl-images-amazon.com/images/I/51pdt7nDnPL._SL1001_.jpg
123,Skin Care, Conti Castile Olive Oil Soap 4 oz (Pack of 2) ,Size:Pack of 2,Conti,NA,5236,4189,20.00%,TRUE,https://images-na.ssl-images-amazon.com/images/I/81iSx1TkrZL._SL1500_.jpg
124,Skin Care, Ubervia Pack of 1 Blackhead Acne Remover Comedone Sharp PointedSteel Tweezer Extractor Face Care Tool ,"Type: Blackhead Remover, Material: Metal, False Eyelash Craft: Hand Made, Size: as the item show, Model Number: BW3701",Ubervia,NA,1925,1100,42.86%,TRUE,https://images-na.ssl-images-amazon.com/images/I/41WpYaySIiL.jpg
125,Skin Care," HaRvic Clean Soft Bath For Travel Paper Soap in flower Design Tube Shape Bottle, 1- Piece ","Light & thin soap flakes that flow, slowly melt in the warm water, people will enjoy its colorful water & great scent! It is gentle that helps to clean and repair skins with the anti-septic effect! The new concept of individual soap suitable for household, traveling or hotel uses. Can use it for hand washing Good for premium & magazine promotions. Suitable for cleaning hand. simply toss a handful of bath confetti under running water and allow the soapy. Easy to carry. Applicable in home, trip, hotel, office and etc. It Is Gentle That Helps To Clean And Repair Skins With Anti-Septic Effect! New Concept Of Individual Soap Suitable For Household, Traveling Or Hotel Uses. Besides For The Bath-Tub Use, You Can Use It For Hand & Face Wash And Even For Shower! Good For Premium & Magazine Promotions. Suitable For Cleaning Hand, Face, Bath, And Etc. Simply Toss A Handful Of Bath Confetti Under Running Water And Allow The Soapy Easy To Carry. Applicable In Home, Trip, Hotel, Office And Etc Specifications: Material: Soap Flower Size;Bottle Diameter: 2.7Cm; About 14Cm. Organic: Yes Fragrance Scent: Mix Type: Cleansing Soap Skin Type: All Skin Types Colour: Multicolour Packing Inclue: 1 x Pieces Petals Paper Clean Soft Soap",HaRvic,NA,306,218,28.76%,TRUE,https://images-na.ssl-images-amazon.com/images/I/41kDJG0uCbL.jpg
126,"Snacks, Dry Fruits, Nuts","Naturals Energy Bar - Walnut Delight Real Sweetness of Honey, 360 g Carton ","About|NaturalÃƒÆ’Ã†â€™Ãƒâ€šÃ‚Â¢ÃƒÆ’Ã‚Â¢ÃƒÂ¢Ã¢â€šÂ¬Ã…Â¡Ãƒâ€šÃ‚Â¬ÃƒÆ’Ã‚Â¢ÃƒÂ¢Ã¢â€šÂ¬Ã…Â¾Ãƒâ€šÃ‚Â¢s Walnut Delight Bar is made with premium entire walnuts, succulent dates and pure honey, each of them a powerhouse of nutrients. Walnuts are a rich basis of proteins, monounsaturated fats and Omega 3 fatty acids, found rarely in nature. It decreases risk of excessive clotting and inflammation and fights cancer. It s a totally natural health bar that includes no harmful trans fats, added sugar, gluten or dairy products.|INGREDIENTS|Walnut, Honey, Dates, Glucose, Rice Crispy, Raisin Linseeds, Date Syrup, Soy Lecithin.|Other Information|For Queries/Feedback/Complaints, Contact our Customer Care Executive at: Phone: 1860 123 1000 | Address: Innovative Retail Concepts Private Limited, No.18, 2nd & 3rd Floor, 80 Feet Main Road, Koramangala 4th Block, Bangalore - 560034 | Email: customerservice@bigbasket.com",Naturals,360 g ,420,420,NA,TRUE,https://www.bigbasket.com/media/uploads/p/l/40003633_1-naturals-energy-bar-walnut-delight-real-sweetness-of-honey.jpg
