54,Fragrances & Deos,"All Good Scents All Good Scents - Chypre Duo Fragrance, For Him, Gift Set, 2 pcs ","About the Product|Gift All Good Scents Perfume set to that special someone in your life or buy it for yourself!!This Chypre Duo Fragrance Set consist of two perfumes, Alive & Cool.All Good Scents Alive - For the Macho Man. Live the life to the fullest. Be a winner of hearts. The quintessential lavender, vanilla and lemon fragrance. For the man who doesn't have to try too hard. he's just naturally and irresistibly macho.All Good Scents Cool - For the Man in Control. Start your day with the freshness of mint. Leave a lingering scent every time you pass desiring for more. The right amount of zest, and they know that you are totally cool..Gift All Good Scents Perfume set to that special someone in your life or buy it for yourself!!This Chypre Duo Fragrance Set consist of two perfumes, Alive & Cool.All Good Scents Alive - For the Macho Man. Live the life to the fullest. Be a winner of hearts. The quintessential lavender, vanilla and lemon fragrance. For the man who doesn't have to try too hard. he's just naturally and irresistibly macho.All Good Scents Cool - For the Man in Control. Start your day with the freshness of mint. Leave a lingering scent every time you pass desiring for more. The right amount of zest, and they know that you are totally cool..Gift All Good Scents Perfume set to that special someone in your life or buy it for yourself!!.This Chypre Duo Fragrance Set consist of two perfumes, Alive & Cool..All Good Scents Alive - For the Macho Man. Live the life to the fullest. Be a winner of hearts. The quintessential lavender, vanilla and lemon fragrance. For the man who doesn't have to try too hard. he's just naturally and irresistibly macho..All Good Scents Cool - For the Man in Control. Start your day with the freshness of mint. Leave a lingering scent every time you pass desiring for more. The right amount of zest, and they know that you are totally cool.|Features|• Travel-friendly• Long lasting scent• Make us feel fresh all day long• Perfect gift for your loved ones.• Travel-friendly• Long lasting scent• Make us feel fresh all day long• Perfect gift for your loved ones.• Travel-friendly.• Long lasting scent.• Make us feel fresh all day long.• Perfect gift for your loved ones|Composition|All Good Scents Alive • Top Notes: Lavender, Rosemary, Lemon• Heart Notes: Clary Sage, Cedar, Rosewood• Base Notes: Oak Moss, White Musk, Tonka BeansAll Good Scents Cool • Top Notes: Coriander, Mint, Fresh Green Notes• Heart Notes: Geranium, Neroli, Marine• Base Notes: Cedar, Oak Moss, White Musk.All Good Scents Alive • Top Notes: Lavender, Rosemary, Lemon• Heart Notes: Clary Sage, Cedar, Rosewood• Base Notes: Oak Moss, White Musk, Tonka BeansAll Good Scents Cool • Top Notes: Coriander, Mint, Fresh Green Notes• Heart Notes: Geranium, Neroli, Marine• Base Notes: Cedar, Oak Moss, White Musk.All Good Scents Alive .• Top Notes: Lavender, Rosemary, Lemon.• Heart Notes: Clary Sage, Cedar, Rosewood.• Base Notes: Oak Moss, White Musk, Tonka Beans.All Good Scents Cool .• Top Notes: Coriander, Mint, Fresh Green Notes.• Heart Notes: Geranium, Neroli, Marine.• Base Notes: Cedar, Oak Moss, White Musk|How to Use|• Apply it on your pulse points.• Apply it on your pulse points.• Apply it on your pulse points|Other Product Info|EAN Code: 40151930  Manufacturer Name & Address: SUHAN AEROSOL, J/1-8; Radheshyam Industrial Complex NH3 Highway Village - Asangaon West, Taluka, Shahpur, Maharashtra  Marketed by: 603, Matrix B/H Divya Bhaskar SG Highway Ahmedabad  Best before 27-01-2022  For queries call 1860 123 1000",All Good Scents,2 pcs ,1500,1350,150%,TRUE,https://www.bigbasket.com/media/uploads/p/l/40151930_2-all-good-scents-all-good-scents-chypre-duo-fragrance-for-him-gift-set.jpg
55,Fragrances & Deos,"Engage On Pocket Perfume - Man, Cool Marine, 18 ml ","About the Product|A timeless Classical Fragrance with bursts of Cologne, patchouli and fresh Woody notes.  For Beauty tips, tricks & more visit http://lookbeautiful.in/  For Beauty tips, tricks & more visitÃ‚Â https://bigbasket.blog/|Other Product Info|EAN Code: 8901725958282  Best before 28-07-2020  For Queries/Feedback/Complaints, Contact our Customer Care Executive at: Phone: 1860 123 1000 | Address: Innovative Retail Concepts Private Limited, No.18, 2nd & 3rd Floor, 80 Feet Main Road, Koramangala 4th Block, Bangalore - 560034 | Email: customerservice@bigbasket.com",Engage,18 ml ,60,60,NA,FALSE,https://www.bigbasket.com/media/uploads/p/l/40103159_1-engage-on-pocket-perfume-man-cool-marine.jpg
56,Fragrances & Deos,"Ajmal Cento EDP Oriental Perfume For Men, 100 ml ","About the Product|Cento is a modern tribute to classic masculine fragrances. The heart notes are composed of lavender and Muguet. The deep and intense character of the fragrance is built on the leathery mossy woody notes along with patchouli and sandalwood in the base.|Composition|Alcohol Denat, Aqua (Water), Fragrance, Butylphenyl Methylpropional, Citral Citronellol, Coumarin, Geraniol, Hexyl Cinnamal, Limonene, Linalool, Alcohol Content: 75% w/w Ethyl Alcohol with 1% Diethyl Phthalate..Alcohol Denat, Aqua (Water), Fragrance, Butylphenyl Methylpropional, Citral Citronellol, Coumarin, Geraniol, Hexyl Cinnamal, Limonene, Linalool, Alcohol Content: 75% w/w Ethyl Alcohol with 1% Diethyl Phthalate.|How to Use|Shake well. Hold the bottle in an upright position, 5 cm to 10 cm away from the body and spray liberally..Shake well. Hold the bottle in an upright position, 5 cm to 10 cm away from the body and spray liberally.|Other Product Info|EAN Code: 6293708010554  Manufactured & marketed by: Ajmals Perfume, Manufacturing & oudh Processing industry (L.L.C) P.O.Box:3141, Dubai U.A.E  Imported by: Building No.22, -, 2Nd Pasta Lane, Colaba, Mumbai City, Maharashtra, 400005  Country of Origin: UAE  Best Before 22-01-2021  For Queries/Feedback/Complaints, Contact our Customer Care Executive at: Phone: 1860 123 1000 | Address: Innovative Retail Concepts Private Limited, No.18, 2nd & 3rd Floor, 80 Feet Main Road, Koramangala 4th Block, Bangalore - 560034 | Email: customerservice@bigbasket.com",Ajmal,100 ml ,2200,1760,20%,TRUE,https://rukminim1.flixcart.com/image/416/416/ka73y4w0/perfume/g/t/r/200-cento-edp-citrus-aromatic-perfume-100ml-for-men-and-zeal-edp-original-imafrtj2ukevtyjf.jpeg?q=70
57,Fragrances & Deos,"Beverly Hills Polo Club Perfume - Club Gift Set Edt (For Men), 1 pc Carton ","About the Product|BHPC Personal Care Pvt Ltd company delivers world-class fragrances, all the fragrances are selected individually keeping in mind consumers across the globe. Rigorous testing and consumer feedback is used to make it acceptable and have a unique fragrance which is liked and preferred..BHPC Personal Care Pvt Ltd company delivers world-class fragrances, all the fragrances are selected individually keeping in mind consumers across the globe. Rigorous testing and consumer feedback is used to make it acceptable and have a unique fragrance which is liked and preferred..BHPC Personal Care Pvt Ltd company delivers world-class fragrances, all the fragrances are selected individually keeping in mind consumers across the globe. Rigorous testing and consumer feedback is used to make it acceptable and have a unique fragrance which is liked and preferred.|Features|• The gift pack includes a sensual fragrance that exudes freshness and awakens your senses• The scent uplifts your mood and prepares you to take on the day• Travle friendly.• The gift pack includes a sensual fragrance that exudes freshness and awakens your senses• The scent uplifts your mood and prepares you to take on the day• Travle friendly.• The gift pack includes a sensual fragrance that exudes freshness and awakens your senses.• The scent uplifts your mood and prepares you to take on the day.• Travle friendly|Other Product Info|EAN Code: 40021285  For Queries/Feedback/Complaints, Contact our Customer Care Executive at: Phone: 1860 123 1000 | Address: Innovative Retail Concepts Private Limited, No.18, 2nd & 3rd Floor, 80 Feet Main Road, Koramangala 4th Block, Bangalore - 560034 | Email: customerservice@bigbasket.com",Beverly Hills Polo Club,1 pc ,1199,1199,NA,FALSE,https://www.bigbasket.com/media/uploads/p/l/40021285_2-beverly-hills-polo-club-perfume-club-gift-set-edt-for-men.jpg
58,Fragrances & Deos,"Nissan Patrol Eau De Parfum For Men, 100 ml ","About the Product|It is a modern fragrance opening with a joyful note of green apple and birch leaf. A vegetal top note giving way to the pure scent of ocean and lavender..It is a modern fragrance opening with a joyful note of green apple and birch leaf. A vegetal top note giving way to the pure scent of ocean and lavender..It is a modern fragrance opening with a joyful note of green apple and birch leaf. A vegetal top note giving way to the pure scent of ocean and lavender.|Other Product Info|EAN Code: 40153165  Manufacturer Name & Address: M/s. TEMPTATION INTERNATIONAL LLC, ST. MARTINS LANE, SEVERNA PARK, MD - (United States)  Imported by: Kredo Beauty Pvt Ltd, 340/1, Sultanpur, MG Road, Newdelhi-11030  Country of Origin: USA  Best before 18-07-2021  For Queries/Feedback/Complaints, Contact our Customer Care Executive at: Phone: 1860 123 1000 | Address: INNOVATIVE RETAIL CONCEPTS PRIVATE LIMITED No.18, 2nd & 3rd Floor, 80 Feet Main Road, Koramangala 4th Block, Bangalore - 560034. | Email: customerservice@bigbasket.com|How to Use|• Turn the direction of the spray bottle towards your body while spraying• Shake well before use• Use it daily for desired results• Avoid contact with eyes• Do not apply to broken or inflamed skin.• Turn the direction of the spray bottle towards your body while spraying• Shake well before use• Use it daily for desired results• Avoid contact with eyes• Do not apply to broken or inflamed skin.• Turn the direction of the spray bottle towards your body while spraying.• Shake well before use.• Use it daily for desired results.• Avoid contact with eyes.• Do not apply to broken or inflamed skin|Composition|Grapefruit, Birch Leaf, Green Apple, Sage, Lavender, Oceanic Notes, Moss, Patchouli And Cedarwood, Alcohol Denat, Water, d-limonene, Formaldehyde Cyclobutyl Ethyl Acetal, Isoamyl Acetate..Grapefruit, Birch Leaf, Green Apple, Sage, Lavender, Oceanic Notes, Moss, Patchouli And Cedarwood, Alcohol Denat, Water, d-limonene, Formaldehyde Cyclobutyl Ethyl Acetal, Isoamyl Acetate..Grapefruit, Birch Leaf, Green Apple, Sage, Lavender, Oceanic Notes, Moss, Patchouli And Cedarwood, Alcohol Denat, Water, d-limonene, Formaldehyde Cyclobutyl Ethyl Acetal, Isoamyl Acetate.|Features|• It captivates your senses• An Exquisite fragrance that appeals to all ages.• It captivates your senses• An Exquisite fragrance that appeals to all ages.• It captivates your senses.• An Exquisite fragrance that appeals to all ages",Nissan,100 ml ,1795,1615.5,180%,FALSE,https://www.bigbasket.com/media/uploads/p/l/40153165_2-nissan-patrol-eau-de-parfum-for-men.jpg
59,Fragrances & Deos,"Dkny Be Golden Delicious Eau De Parfum, 100 ml ","About the Product|DKNY Golden Delicious glistens with a glamorous burst of succulent orange flower water. The heart beats deeper with floral touches of white rose and muguet flower. In the base, musk, sandalwood, and teakwood blend together, lending a warm, lasting touch of sensuality. And, of course, the scent of a golden delicious apple provides an elegant and memorable character that shines throughout the life of the scent..DKNY Golden Delicious glistens with a glamorous burst of succulent orange flower water. The heart beats deeper with floral touches of white rose and muguet flower. In the base, musk, sandalwood, and teakwood blend together, lending a warm, lasting touch of sensuality. And, of course, the scent of a golden delicious apple provides an elegant and memorable character that shines throughout the life of the scent.|How to Use|Spray it twice on your pulse points. Some such points are located behind your ear, at the bottom of your throat, on your wrist, inside your elbow, and behind your knee..Spray it twice on your pulse points. Some such points are located behind your ear, at the bottom of your throat, on your wrist, inside your elbow, and behind your knee.|Other Product Info|EAN Code: 100571077  Best before 14-01-2022  For Queries/Feedback/Complaints, Contact our Customer Care Executive at: Phone: 1860 123 1000 | Address: Innovative Retail Concepts Private Limited, No.18, 2nd & 3rd Floor, 80 Feet Main Road, Koramangala 4th Block, Bangalore - 560034 | Email: customerservice@bigbasket.com",Dkny,100 ml ,5200,3120,40%,TRUE,https://images-na.ssl-images-amazon.com/images/I/415IDzYcS3L.jpg
60,Fragrances & Deos,"Guess Night Deodorant Spray, 96 ml ","About the Product|A Fresh Woody Fougere Fragrance that is playfully spicy and woody, GUESS Night is bursting with heady, energetic notes to keep you going until the sun comes up.|Other Product Info|EAN Code: 40139293  Best before 14-01-2022  For Queries/Feedback/Complaints, Contact our Customer Care Executive at: Phone: 1860 123 1000 | Address: Innovative Retail Concepts Private Limited, No.18, 2nd & 3rd Floor, 80 Feet Main Road, Koramangala 4th Block, Bangalore - 560034 | Email: customerservice@bigbasket.com",Guess,96 ml ,400,352,12%,TRUE,https://images-na.ssl-images-amazon.com/images/I/71D78IieVXL._SL1408_.jpg
61,Ghee & Oils,Disano Olive Oil Plastic Bottle  (1 L),,Disano,1 L,"1,250",620,Bank Offer 10% Cashback* on HDFC Bank Debit Cards T&C | Bank Offer 5% Unlimited Cashback on Flipkart Axis Bank Credit Card T&C | Bank Offer Extra 5% off* with Axis Bank Buzz Credit Card T&C | No Cost EMI on Flipkart Axis Bank Credit Card T&C,TRUE,https://rukminim1.flixcart.com/image/832/832/jzeg6fk0/edible-oil/u/v/r/1-na-plastic-bottle-olive-oil-disano-original-imafjf6gn4hzncdp.jpeg?q=70
62,Ghee & Oils,Nova Shudh Ghee 1 L Plastic Bottle,,Nova,1 L Plastic Bottle,530,462,Bank Offer 10% Cashback* on HDFC Bank Debit Cards T&C | Bank Offer 5% Unlimited Cashback on Flipkart Axis Bank Credit Card T&C | Bank Offer Extra 5% off* with Axis Bank Buzz Credit Card T&C | No Cost EMI on Flipkart Axis Bank Credit Card T&C,TRUE,https://rukminim1.flixcart.com/image/832/832/jz30nm80/ghee/j/g/g/1-shudh-plastic-bottle-nova-original-imafj69htnhartty.jpeg?q=70
63,Grocery & Gourmet Foods," CHOCOCRAFT, Unique womens day gifts, 6 Chocolate Gift Box, chocolates gifts ","This Chocolate Gift Box contains delectable assorted Chocolates. Filled with roasted almonds, fruit & nuts and butter scotch, they will tempt and delight the taste buds. These are packed in a beautiful wooden box especially designed for an elegant presentation. The sturdy box can be reused. The best gift for women's day. Lots of options for box design & chocolate design. ChocoCraft is the manufacturer of customised chocolates specialise in making printed chocolates. We offer gifting solutions for corporates and personal occasions.",CHOCOCRAFT,227 Grams,695,595,14.39%,TRUE,https://images-na.ssl-images-amazon.com/images/I/81I7V9mVUcL._SL1500_.jpg
64,Grocery & Gourmet Foods, Dry Fruit Wala Dried Seedless Apricot 500GM ,"Dry Fruit Wala brings to you a range of fine nuts and dry fruits. Dry Fruit Wala products are packaged to retain freshness, taste and texture ensuring fine products in your hands. All nuts and dry fruits are hygienically packed in a facility meeting food safety standards.",Dry Fruit Wala,NA,565,399,29.38%,TRUE,https://images-na.ssl-images-amazon.com/images/I/61rIBLvJ49L._SL1400_.jpg
65,Grocery & Gourmet Foods, BSD Organics Dry Fenugreek Leaves Fenugreek/Methi/kasturi Methi Leaves granules - 700 G ,"BSD Organics Dry Fenugreek leaves / kasuri methi / kasturi methi leaves granules benefits are :Fenugreek is also known as ‘Kasuri Methi’. It is a very ancient spice which is used for flavouring various dishes. These leaves are bitter in taste, when added to any recipe it will surely titillate your taste bud. In addition to taste, it has numerous nutritional values as well. fenugreek seeds and green leaves are also for cooking various dishes. The seeds are mostly added in preparation of vegetables and pickles. If kept refrigerated in an airtight jar, it can stay longer. Keep away from moisture. Storage instructions: Store in a cool, air tight and dry place We all know that Indian Households cannot do without Methi as it is used in every food preparation due to myriad of wellness benefits. Known as Kasuri Methi in the Indian Subcontinent, leaves have a bitter but pleasant taste as it stimulates the taste buds.",BSD Organics,NA,700,350,50.00%,TRUE,https://images-na.ssl-images-amazon.com/images/I/51Vkz2-QtkL.jpg
66,Grocery & Gourmet Foods, Mystik - Merry Christmas Snow 10 Pc Chocolate Gift Box 9 ,Celebrate this festival of Christmas with Mystik's amazingly beautiful Merry Chritmas Chocolate Gift Pack of 10 pc of chocolates. Make your loved ones crazy upon these hand crafted flavoured chocolates which are so delicious and melts into your mouth and delights you and your loved ones. These are hygenically prepared and packed to serve you a best quality of chocolates.,Mystik,118 Grams,545,545,NA,TRUE,https://images-na.ssl-images-amazon.com/images/I/712zOIltNGL._SL1031_.jpg
67,Grocery & Gourmet Foods, Midiron Beautiful Heart Shape Ceramic Mug with 20 Piece Handmade Gold Chocolate on Diwali Gift ,"Midiron presents a handmade Gold Chocolate in round box and Diwali Quoted Printed Ceramic Heart Handle Mug. A perfect Diwali Gift for your brother, sister, family, friends, associates etc. Midiron Chocolates have unique secret recipes, driven by their unmatched standard for chocolate quality and their passion for creative excellence. They start with the selection of the finest raw materials and highest quality ingredients. A Beautiful Gift for every age Group that comes with 20 Pieces chocolates in round box. So, keep the romance alive and make your beloved feel special. Printed with dye-sublimation technology all prints remain permanent for years without any fading or scratching.",Midiron,NA,999,549,45.05%,TRUE,https://images-na.ssl-images-amazon.com/images/I/81wHyNbKfBL._SL1500_.jpg
68,Grocery & Gourmet Foods, SSP Powder Asafoetida(Hing) 5G ,Premium Quality Compounded Asafoetida,SSP ASAFOETIDA,22.7 Grams,88,81,7.95%,TRUE,https://images-na.ssl-images-amazon.com/images/I/61SOwmGthoL._SL1000_.jpg
69,Grocery & Gourmet Foods, Flavourlite - Dried Apricot Seedless - 250 g ,Dried Apricots have a rich and intense sweet-sour flavor meeting the high expectations of Apricot Connoisseurs! Truly a nutritional Mediterranean snack.,Flavourlite,NA,599,449,25.04%,TRUE,https://images-na.ssl-images-amazon.com/images/I/81dQJsWmuEL._SL1500_.jpg
70,Hair Care,L'Oreal Paris Fall Resist Anti-Hair Fall Conditioner  (10% Extra in Pack)  (65 ml),"Fall Resist 3x Anti-Hair Fall Conditioner delivers a triple anti-hair fall action. Your hair is more resistant from the roots and is stronger, looks healthier and more beautiful. The formula helps deliver a triple anti-hair fall action instantly detangles and your hair is more resistant from root to tip. Fight Hair Fall From The Roots. Restructures Hair Fibre . Hair Grows Stronger.",L'Oreal Paris,65 ml,85,85,Bank Offer 10% Cashback* on HDFC Bank Debit Cards T&C | Bank Offer 5% Unlimited Cashback on Flipkart Axis Bank Credit Card T&C | Bank Offer Extra 5% off* with Axis Bank Buzz Credit Card T&C | No Cost EMI on Flipkart Axis Bank Credit Card T&C,TRUE,https://rukminim1.flixcart.com/image/832/832/k2p1q4w0/conditioner/d/g/g/65-fall-resist-anti-hair-fall-conditioner-l-oreal-paris-original-imafhzhzrbajtthu.jpeg?q=70
71,Hair Care,Himalaya Damage Repair Protein Conditioner  (200 ml),,Himalaya,200 ml,165,148,Bank Offer 10% Cashback* on HDFC Bank Debit Cards T&C | Bank Offer 5% Unlimited Cashback on Flipkart Axis Bank Credit Card T&C | Bank Offer Extra 5% off* with Axis Bank Buzz Credit Card T&C | No Cost EMI on Flipkart Axis Bank Credit Card T&C,TRUE,http://rukmini1.flixcart.com/image/832/832/j4eha4w0/conditioner/7/v/z/200-damage-repair-protein-conditioner-himalaya-original-imaevbnuvpzykebk.jpeg?q=70
72,Hair Care," HERBILICIOUS Heena Leaves Powder Natural Mehendi Chemical-free, 100g ",NA,HERBILICIOUS,NA,200,105,47.50%,TRUE,https://images-na.ssl-images-amazon.com/images/I/41eRYcmAYRL.jpg
73,Hair Care, Shahnaz Husain Shahair Henna Treatment Powder 200gm ,"Shahnaz Husain is a name that has become synonymous with the most advanced Ayurvedic care, not only in terms of highly exclusive salon treatments, but also the legendary range of natural products, founded on the principle of natural care and cure, the Shahnaz Husain Group offers the unique benefit of an integrated system of salon care and product excellence. The Leading Ayurvedic Company is a remarkable confluence of the ancient tradition and the latest scientific research. Product Description: Henna powder is an Ayurvedic medicine (for external use only) for hair. This is a powerful blend of henna and other herbal extracts. It helps to control problems like dandruff and hair loss. Containing amla, brahmi, shikakai, sandalwood, Pudina and henna. It promotes growth and adds body making the hair look thick, strong and healthy. The presence of henna may give the hair a reddish tinge. Directions - Prepare a hair pack by mixing approximately one tea cup of Henna Powder with 2 raw eggs, 4 teaspoon each coffee powder and lemon juice and half cup yoghurt. Apply all over the hair. Let it dry and wash off.",Shahnaz Husain's Vedic Solutions,372 g,875,710,18.86%,TRUE,https://images-na.ssl-images-amazon.com/images/I/91Pr8zBp4sL._SL1500_.jpg
74,Hair Care, Glamour World Ayurvedic Glow Hair Shampoo ,Glow Hair Ayurvedic Shampoo effective for dandruff and hair loss.,GLAMOUR WORLD,NA,235,235,NA,TRUE,https://images-na.ssl-images-amazon.com/images/I/51VzotU2MkL._SL1100_.jpg
75,Hair Care, Tjori Virgin Coconut Milk Shampoo 100 ml ,This organically formulated virgin coconut milk shampoo nourishes your hair by giving natural moisture from roots to ends. This shampoo cleanses the scalp deeply without stripping the natural moisture from the scalp.,Tjori,NA,450,325,27.78%,TRUE,https://images-na.ssl-images-amazon.com/images/I/51msdQfwpjL._SL1180_.jpg
76,Hair Care, BANJARAS HENNA 200g & HIBISCUS HAIR CARE POWDER 100g COMBO ,"Banjara's natural henna powder is made with the finest quality henna leaves powder enriched with other hair care herbs provides an excellent natural color to the hair. It acts as a conditioner and nourishes the roots to make the hair lustrous. Natural henna enriched with amla, Brahmi, bhringraj, methi and hibiscus makes the hair healthy with shine and smooth as silk.",Generic,NA,180,179,0.56%,TRUE,https://images-na.ssl-images-amazon.com/images/I/41TBRt-xXNL.jpg
77,Jams & Honey,Kissan Pineapple Jam 500 g,,Kissan,500 g,150,148,Bank Offer 10% Cashback* on HDFC Bank Debit Cards T&C | Bank Offer 5% Unlimited Cashback on Flipkart Axis Bank Credit Card T&C | Bank Offer Extra 5% off* with Axis Bank Buzz Credit Card T&C | No Cost EMI on Flipkart Axis Bank Credit Card T&C,TRUE,https://rukminim1.flixcart.com/image/832/832/j3orcsw0/jam-spread/x/h/j/500-pineapple-jam-glass-bottle-kissan-original-imaeurkhztdkzjta.jpeg?q=70
78,Jams & Honey,St. Dalfour Wild Blueberry 284 g,,St. Dalfour,284 g,300,270,Bank Offer 10% Cashback* on HDFC Bank Debit Cards T&C | Bank Offer 5% Unlimited Cashback on Flipkart Axis Bank Credit Card T&C | Bank Offer Extra 5% off* with Axis Bank Buzz Credit Card T&C | No Cost EMI on Flipkart Axis Bank Credit Card T&C,TRUE,https://rukminim1.flixcart.com/image/832/832/j8osu4w0-1/jam-spread/h/y/j/284-wild-blueberry-glass-bottle-blueberry-jam-st-dalfour-original-imaeynpezck6vhq8.jpeg?q=70
